species_id,common_name,image_count,description,folder_path,source_url
72486,Egyptian Goose,17,"The Egyptian goose (Egyptian Goose) is a member of the duck, goose, and swan family Anatidae. It is native to Africa south of the Sahara and the Nile Valley.",/kaggle/input/birdsug/birdsuganda/image/Egyptian_Goose,https://www.inaturalist.org/taxa/72486-Egyptian Goose
14588,Common Bulbul,17,"The common bulbul (Common Bulbul) is a member of the bulbul family of passerine birds. It is found in north-eastern, northern, western and central Africa.",/kaggle/input/birdsug/birdsuganda/image/Common_Bulbul,https://www.inaturalist.org/taxa/14588-Common Bulbul
3743,Hadada Ibis,17,"The hadada or hadeda ibis (Hadada Ibis), is an ibis found in Sub-Saharan Africa.",/kaggle/input/birdsug/birdsuganda/image/Hadada_Ibis,https://www.inaturalist.org/taxa/3743-Hadada Ibis
1428,Helmeted Guineafowl,17,"The helmeted guineafowl (Helmeted Guineafowl) is the best known of the guineafowl bird family, Numididae, and the only member of the genus Numida. It is native to Africa, mainly south of the Sahara, and has been widely introduced into the West Indies, Brazil, Australia and Europe (e.g. southern France).",/kaggle/input/birdsug/birdsuganda/image/Helmeted_Guineafowl,https://www.inaturalist.org/taxa/1428-Helmeted Guineafowl
1455922,Laughing Dove,17,"The laughing dove (Laughing Dove) is a small pigeon that is a resident breeder in Africa, the Middle East, South Asia, and Western Australia where it has established itself in the wild after being released from Perth Zoo in 1898. This small long-tailed dove is found in dry scrub and semi-desert habitats where pairs can often be seen feeding on the ground. It is closely related to the spotted dove (Spilopelia chinensis) which is distinguished by...",/kaggle/input/birdsug/birdsuganda/image/Laughing_Dove,https://www.inaturalist.org/taxa/1455922-Laughing Dove
4870,Blacksmith Lapwing,17,"The blacksmith lapwing or blacksmith plover (Blacksmith Lapwing) occurs commonly from Kenya through central Tanzania to southern and southwestern Africa. The vernacular name derives from the repeated metallic 'tink, tink, tink' alarm call, which suggests a blacksmith's hammer striking an anvil.",/kaggle/input/birdsug/birdsuganda/image/Blacksmith_Lapwing,https://www.inaturalist.org/taxa/4870-Blacksmith Lapwing
4954,Grey Heron,17,"The grey heron (Grey Heron) is a long-legged predatory wading bird of the heron family, Ardeidae, native throughout temperate Europe and Asia and also parts of Africa. It is resident in much of its range, but some populations from the more northern parts migrate southwards in autumn. A bird of wetland areas, it can be seen around lakes, rivers, ponds, marshes and on the sea coast. It feeds mostly on aquatic creatures which it catches after...",/kaggle/input/birdsug/birdsuganda/image/Grey_Heron,https://www.inaturalist.org/taxa/4954-Grey Heron
20526,Common Ostrich,17,"The ostrich or common ostrich (Common Ostrich) is either one or two species of large flightless birds native to Africa, the only living member(s) of the genus Struthio, which is in the ratite family. In 2014, the Somali ostrich (Struthio molybdophanes) was recognized as a distinct species.",/kaggle/input/birdsug/birdsuganda/image/Common_Ostrich,https://www.inaturalist.org/taxa/20526-Common Ostrich
411086,Western Cattle-Egret,17,"The cattle egret (Bubulcus ibis) is a cosmopolitan species of heron (family Ardeidae) found in the tropics, subtropics and warm temperate zones. It is the only member of the monotypic genus Bubulcus, although some authorities regard two of its subspecies as full species, the western cattle egret and the eastern cattle egret. Despite the similarities in plumage to the egrets of the genus Egretta, it is more closely related to the herons of Ardea. Originally native...",/kaggle/input/birdsug/birdsuganda/image/Western_Cattle-Egret,https://www.inaturalist.org/taxa/411086-Western Cattle-Egret
1505670,African Fish-Eagle,17,"The African fish eagle (African Fish-Eagle) or the African sea eagle is a large species of eagle found throughout sub-Saharan Africa wherever large bodies of open water with an abundant food supply occur. It is the national bird of Malawi, Namibia, Zambia, and Zimbabwe. As a result of its large range, it is known in many languages. Examples of names include: Vis Arend in Afrikaans, nkwazi in Chewa, aigle pêcheur in French, hungwe in Shona, inkwazi...",/kaggle/input/birdsug/birdsuganda/image/African_Fish-Eagle,https://www.inaturalist.org/taxa/1505670-African Fish-Eagle
8268,Fork-tailed Drongo,17,"The fork-tailed drongo, also called the common drongo, African drongo, or savanna drongo (Fork-tailed Drongo), is a species of drongo in the family Dicruridae, which are medium-sized passerine birds of the Old World. It is native to the tropics, subtropics and temperate zones of the Afrotropics. Its range was formerly considered to include Asia, but the Asian species is now called the black drongo (Dicrurus macrocercus).",/kaggle/input/birdsug/birdsuganda/image/Fork-tailed_Drongo,https://www.inaturalist.org/taxa/8268-Fork-tailed Drongo
2988,Red-eyed Dove,17,"The red-eyed dove (Red-eyed Dove) is a pigeon which is a widespread resident breeding bird in Africa south of the Sahara. It is a common, if not abundant, species in most habitats other than desert.",/kaggle/input/birdsug/birdsuganda/image/Red-eyed_Dove,https://www.inaturalist.org/taxa/2988-Red-eyed Dove
508246,Reed Cormorant,17,"The reed cormorant (Reed Cormorant), also known as the long-tailed cormorant, is a bird in the cormorant family Phalacrocoracidae. It breeds in much of Africa south of the Sahara, and Madagascar. It is resident but undertakes some seasonal movements.",/kaggle/input/birdsug/birdsuganda/image/Reed_Cormorant,https://www.inaturalist.org/taxa/508246-Reed Cormorant
3739,African Sacred Ibis,17,The African sacred ibis (African Sacred Ibis) is a species of ibis. Its sister species is the Australian white ibis.,/kaggle/input/birdsug/birdsuganda/image/African_Sacred_Ibis,https://www.inaturalist.org/taxa/3739-African Sacred Ibis
13804,Southern Masked Weaver,17,The southern masked weaver or African masked weaver (Southern Masked Weaver) is a resident breeding bird species common throughout southern Africa.,/kaggle/input/birdsug/birdsuganda/image/Southern_Masked_Weaver,https://www.inaturalist.org/taxa/13804-Southern Masked Weaver
2662,Pied Kingfisher,17,"The pied kingfisher (Pied Kingfisher) is a water kingfisher and is found widely distributed across Africa and Asia. Originally described by Linnaeus in 1758, it has five recognised subspecies. Its black and white plumage, crest and the habit of hovering over clear lakes and rivers before diving for fish make it distinctive. Males have a double band across the breast while females have a single gorget that is often broken in the middle. They are usually...",/kaggle/input/birdsug/birdsuganda/image/Pied_Kingfisher,https://www.inaturalist.org/taxa/2662-Pied Kingfisher
4972,Black-headed Heron,17,"The black-headed heron (Black-headed Heron) is a wading bird of the heron family Ardeidae, common throughout much of sub-Saharan Africa and Madagascar. It is mainly resident, but some west African birds move further north in the rainy season.",/kaggle/input/birdsug/birdsuganda/image/Black-headed_Heron,https://www.inaturalist.org/taxa/4972-Black-headed Heron
204531,Southern Fiscal,17,The southern fiscal or fiscal shrike (Southern Fiscal) is a member of the shrike family found through most of Sub-Saharan Africa. It is also sometimes named jackie hangman or butcher bird due to its habit of impaling its prey on acacia thorns to store the food for later consumption. It was previously lumped together with the northern fiscal (Lanius humeralis). Together they were known as the common fiscal.,/kaggle/input/birdsug/birdsuganda/image/Southern_Fiscal,https://www.inaturalist.org/taxa/204531-Southern Fiscal
5268,Black Kite,17,"The black kite (Black Kite) is a medium-sized bird of prey in the family Accipitridae, which also includes many other diurnal raptors. It is thought to be the world's most abundant species of Accipitridae, although some populations have experienced dramatic declines or fluctuations. Current global population estimates run up to 6 million individuals. Unlike others of the group, black kites are opportunistic hunters and are more likely to scavenge. They spend a lot of time soaring",/kaggle/input/birdsug/birdsuganda/image/Black_Kite,https://www.inaturalist.org/taxa/5268-Black Kite
4943,Little Egret,17,"The little egret (Little Egret) is a species of small heron in the family Ardeidae. The genus name comes from the Provençal French Aigrette, ""egret"", a diminutive of Aigron,"" heron"". The species epithet garzetta is from the Italian name for this bird, garzetta or sgarzetta.",/kaggle/input/birdsug/birdsuganda/image/Little_Egret,https://www.inaturalist.org/taxa/4943-Little Egret
2269,Lilac-breasted Roller,17,"The lilac-breasted roller (Lilac-breasted Roller) is an African member of the roller family of birds. It is widely distributed in sub-Saharan Africa and the southern Arabian Peninsula, preferring open woodland and savanna; it is largely absent from treeless places. Usually found alone or in pairs, it perches conspicuously at the tops of trees, poles or other high vantage points from where it can spot insects, lizards, scorpions, snails, small birds and rodents moving about at ground...",/kaggle/input/birdsug/birdsuganda/image/Lilac-breasted_Roller,https://www.inaturalist.org/taxa/2269-Lilac-breasted Roller
8038,Pied Crow,17,The pied crow (Pied Crow) is a widely distributed African bird species in the crow genus.,/kaggle/input/birdsug/birdsuganda/image/Pied_Crow,https://www.inaturalist.org/taxa/8038-Pied Crow
4270,Great Cormorant,17,"The great cormorant (Great Cormorant), known as the great black cormorant across the Northern Hemisphere, the black cormorant in Australia, the large cormorant in India and the black shag further south in New Zealand, is a widespread member of the cormorant family of seabirds. The genus name is Latinised Ancient Greek, from φαλακρός (phalakros, ""bald"") and κόραξ (korax, ""raven""), and carbo is Latin for ""charcoal"".",/kaggle/input/birdsug/birdsuganda/image/Great_Cormorant,https://www.inaturalist.org/taxa/4270-Great Cormorant
5363,White-backed Vulture,17,"The white-backed vulture (White-backed Vulture) is an Old World vulture in the family Accipitridae, which also includes eagles, kites, buzzards and hawks. It is closely related to the European griffon vulture, G. fulvus. Sometimes it is called African white-backed vulture to distinguish it from the Oriental white-backed vulture — nowadays usually called white-rumped vulture — to which it was formerly believed to be closely related.",/kaggle/input/birdsug/birdsuganda/image/White-backed_Vulture,https://www.inaturalist.org/taxa/5363-White-backed Vulture
13699,Cape Wagtail,17,"The Cape wagtail, also known as Wells's wagtail, (Cape Wagtail) is a small African passerine bird in the family Motacillidae, which includes the wagtails, pipits and longclaws.",/kaggle/input/birdsug/birdsuganda/image/Cape_Wagtail,https://www.inaturalist.org/taxa/13699-Cape Wagtail
3036,Speckled Pigeon,17,"The speckled pigeon (Speckled Pigeon), or (African) rock pigeon, is a pigeon that is a resident breeding bird in much of Africa south of the Sahara. It is a common and widespread species in open habitats over much of its range, although there are sizable gaps in its distribution.",/kaggle/input/birdsug/birdsuganda/image/Speckled_Pigeon,https://www.inaturalist.org/taxa/3036-Speckled Pigeon
4388,Kelp Gull,17,"The  kelp gull (Kelp Gull), also known as the Dominican gull, is a gull which breeds on coasts and islands through much of the Southern Hemisphere. The nominate L. d. dominicanus is the subspecies found around South America, parts of Australia (where it overlaps with the Pacific gull), and New Zealand (where it is known as the southern black-backed gull, simply the black-backed gull, or by its Māori name karoro). L. d. vetula (known as...",/kaggle/input/birdsug/birdsuganda/image/Kelp_Gull,https://www.inaturalist.org/taxa/4388-Kelp Gull
13853,Cape Sparrow,17,"The Cape sparrow or mossie (Cape Sparrow) is a bird of the sparrow family Passeridae found in southern Africa. A medium-sized sparrow at 14–16 centimetres (5.5–6.3 in), it has distinctive plumage, including large pale head stripes in both sexes. Its plumage is mostly coloured grey, brown, and chestnut, and the male has some bold black and white markings on its head and neck. The species inhabits semi-arid savannah, cultivated areas, and towns, and ranges from the central...",/kaggle/input/birdsug/birdsuganda/image/Cape_Sparrow,https://www.inaturalist.org/taxa/13853-Cape Sparrow
13858,House Sparrow,17,"The house sparrow (House Sparrow) is a bird of the sparrow family Passeridae, found in most parts of the world. A small bird, it has a typical length of 16 cm (6.3 in) and a mass of 24–39.5 g (0.85–1.39 oz). Females and young birds are coloured pale brown and grey, and males have brighter black, white, and brown markings. One of about 25 species in the genus Passer, the house sparrow is native to most of Europe, the Mediterranean Basin,...",/kaggle/input/birdsug/birdsuganda/image/House_Sparrow,https://www.inaturalist.org/taxa/13858-House Sparrow
204554,Red-winged Starling,17,"The red-winged starling (Red-winged Starling) is a bird of the starling family Sturnidae native to eastern Africa from Ethiopia to the Cape in South Africa. It is known in Afrikaans as the rooivlerkspreeu, and as iSomi in Xhosa and Zulu.",/kaggle/input/birdsug/birdsuganda/image/Red-winged_Starling,https://www.inaturalist.org/taxa/204554-Red-winged Starling
